[
  {
    "id": "Q-A1-GRM-001-001",
    "version": 1,
    "level": "A1",
    "objective_id": "FR-A1-GRM-001",
    "variant_group": "A1-GRM-001-v1",
    "format": "mcq",
    "instruction": "Choose the correct answer.",
    "prompt": "Complete the sentence: Je ___ anglais. (I am English.)",
    "choices": [
      "suis",
      "es",
      "est"
    ],
    "answer": "suis",
    "answer_check": {
      "mode": "normalised",
      "accent_policy": "near_miss"
    },
    "hint": "Think about which form of 'to be' goes with 'je' (I).",
    "explanation": "'Je' (I) goes with 'suis', the 'I' form of 'to be' (être). Say 'Je suis' to mean 'I am'.",
    "wrong_answer_feedback": {
      "es": "'Es' goes with 'tu' (you), not with 'je' (I).",
      "est": "'Est' goes with 'il' or 'elle' (he or she), not with 'je' (I)."
    },
    "difficulty": 1,
    "status": "generated",
    "provenance": {
      "method": "ai-generated",
      "model_tier": "haiku",
      "batch_id": "B001",
      "date": "2026-10-31"
    },
    "acceptable_alternatives": []
  },
  {
    "id": "Q-A1-GRM-001-002",
    "version": 1,
    "level": "A1",
    "objective_id": "FR-A1-GRM-001",
    "variant_group": "A1-GRM-001-v2",
    "format": "fill_blank",
    "instruction": "Fill the gap.",
    "prompt": "Nous ___ fatigués.",
    "answer": "sommes",
    "answer_check": {
      "mode": "normalised",
      "accent_policy": "near_miss"
    },
    "hint": "This is the 'we' form of 'to be'.",
    "explanation": "'Nous' (we) goes with 'sommes', the 'we' form of 'to be' (être). The sentence means 'We are tired.'",
    "difficulty": 1,
    "status": "generated",
    "provenance": {
      "method": "ai-generated",
      "model_tier": "haiku",
      "batch_id": "B001",
      "date": "2026-10-31"
    },
    "acceptable_alternatives": []
  },
  {
    "id": "Q-A1-GRM-001-003",
    "version": 1,
    "level": "A1",
    "objective_id": "FR-A1-GRM-001",
    "variant_group": "A1-GRM-001-v3",
    "format": "fill_blank",
    "instruction": "Fill the gap.",
    "prompt": "J'___ un chat. (I have a cat.)",
    "answer": "ai",
    "acceptable_alternatives": [
      "J'ai"
    ],
    "answer_check": {
      "mode": "normalised",
      "accent_policy": "near_miss"
    },
    "hint": "This is the 'I' form of the verb 'to have' (avoir).",
    "explanation": "'Avoir' means 'to have'. With 'je' (I) it becomes 'j'ai', so 'J'ai un chat' means 'I have a cat.'",
    "difficulty": 1,
    "status": "generated",
    "provenance": {
      "method": "ai-generated",
      "model_tier": "haiku",
      "batch_id": "B001",
      "date": "2026-10-31"
    }
  },
  {
    "id": "Q-A1-GRM-001-004",
    "version": 1,
    "level": "A1",
    "objective_id": "FR-A1-GRM-001",
    "variant_group": "A1-GRM-001-v4",
    "format": "translate_en_fr",
    "instruction": "Translate into French.",
    "prompt": "The coffee is hot.",
    "answer": "Le café est chaud.",
    "answer_check": {
      "mode": "normalised",
      "accent_policy": "near_miss"
    },
    "hint": "Use the 'is' form of 'to be' (être) with 'le café' (the coffee).",
    "explanation": "'Est' means 'is', the form of 'être' (to be) for one thing. 'Le café est chaud' means 'The coffee is hot.'",
    "difficulty": 2,
    "status": "generated",
    "provenance": {
      "method": "ai-generated",
      "model_tier": "haiku",
      "batch_id": "B001",
      "date": "2026-10-31"
    },
    "acceptable_alternatives": []
  },
  {
    "id": "Q-A1-GRM-004-001",
    "version": 1,
    "level": "A1",
    "objective_id": "FR-A1-GRM-004",
    "variant_group": "A1-GRM-004-v1",
    "format": "mcq",
    "instruction": "Choose the correct word.",
    "prompt": "Which word fits the gap? ___ livre (the book)",
    "choices": [
      "le",
      "la",
      "les"
    ],
    "answer": "le",
    "answer_check": {
      "mode": "normalised",
      "accent_policy": "near_miss"
    },
    "hint": "Think about whether 'livre' is a 'he' word or a 'she' word.",
    "explanation": "In French every thing-word is either a 'he' word or a 'she' word. 'Livre' is a 'he' word, so it takes 'le'.",
    "wrong_answer_feedback": {
      "la": "'La' goes with 'she' words, and 'livre' is a 'he' word.",
      "les": "'Les' is for more than one thing, but 'livre' here means just one book."
    },
    "difficulty": 1,
    "status": "generated",
    "provenance": {
      "method": "ai-generated",
      "model_tier": "haiku",
      "batch_id": "B001",
      "date": "2026-10-31"
    },
    "acceptable_alternatives": []
  },
  {
    "id": "Q-A1-GRM-004-002",
    "version": 1,
    "level": "A1",
    "objective_id": "FR-A1-GRM-004",
    "variant_group": "A1-GRM-004-v2",
    "format": "fill_blank",
    "instruction": "Fill the gap.",
    "prompt": "C'est ___ table. (It's a table.)",
    "answer": "une",
    "answer_check": {
      "mode": "normalised",
      "accent_policy": "near_miss"
    },
    "hint": "'Table' is a 'she' word, so choose the 'a' word that goes with 'she' words.",
    "explanation": "'Table' is a 'she' word, so 'a' becomes 'une' rather than 'un'. Use 'un' before 'he' words, such as 'un livre'.",
    "difficulty": 1,
    "status": "generated",
    "provenance": {
      "method": "ai-generated",
      "model_tier": "haiku",
      "batch_id": "B001",
      "date": "2026-10-31"
    },
    "acceptable_alternatives": []
  },
  {
    "id": "Q-A1-GRM-004-003",
    "version": 1,
    "level": "A1",
    "objective_id": "FR-A1-GRM-004",
    "variant_group": "A1-GRM-004-v3",
    "format": "mcq",
    "instruction": "Choose the correct word.",
    "prompt": "Which word fits the gap? ___ maison (the house)",
    "choices": [
      "le",
      "la",
      "un"
    ],
    "answer": "la",
    "answer_check": {
      "mode": "normalised",
      "accent_policy": "near_miss"
    },
    "hint": "Check whether 'maison' is a 'he' word or a 'she' word, and whether you need 'the' or 'a'.",
    "explanation": "'Maison' (house) is a 'she' word, so 'the' is 'la'. 'Un' means 'a', so it would give 'a house' instead.",
    "wrong_answer_feedback": {
      "le": "'Le' is for 'he' words, and 'maison' is a 'she' word.",
      "un": "'Un' means 'a', not 'the', so it does not fit 'the house'."
    },
    "difficulty": 1,
    "status": "generated",
    "provenance": {
      "method": "ai-generated",
      "model_tier": "haiku",
      "batch_id": "B001",
      "date": "2026-10-31"
    },
    "acceptable_alternatives": []
  },
  {
    "id": "Q-A1-GRM-004-004",
    "version": 1,
    "level": "A1",
    "objective_id": "FR-A1-GRM-004",
    "variant_group": "A1-GRM-004-v4",
    "format": "fill_blank",
    "instruction": "Fill the gap.",
    "prompt": "Je vois ___ chien. (I see the dog.)",
    "answer": "le",
    "answer_check": {
      "mode": "normalised",
      "accent_policy": "near_miss"
    },
    "hint": "Remember which 'the' word goes with 'he' words.",
    "explanation": "'Chien' (dog) is a 'he' word, so 'the' is 'le' here. 'Le' is shortened to 'l'' only before a vowel sound.",
    "difficulty": 2,
    "status": "generated",
    "provenance": {
      "method": "ai-generated",
      "model_tier": "haiku",
      "batch_id": "B001",
      "date": "2026-10-31"
    },
    "acceptable_alternatives": []
  },
  {
    "id": "Q-A1-GRM-007-001",
    "version": 1,
    "level": "A1",
    "objective_id": "FR-A1-GRM-007",
    "variant_group": "A1-GRM-007-v1",
    "format": "fill_blank",
    "instruction": "Fill the gap.",
    "prompt": "Je ne parle ___ français.",
    "answer": "pas",
    "answer_check": {
      "mode": "normalised",
      "accent_policy": "near_miss"
    },
    "hint": "The second half of 'not' goes after the verb.",
    "explanation": "'Ne' goes before the action word (the verb) and 'pas' goes after it. Together they make 'not', as in 'Je ne parle pas français' (I don't speak French).",
    "difficulty": 2,
    "status": "generated",
    "provenance": {
      "method": "ai-generated",
      "model_tier": "haiku",
      "batch_id": "B001",
      "date": "2026-10-31"
    },
    "acceptable_alternatives": []
  },
  {
    "id": "Q-A1-GRM-007-002",
    "version": 1,
    "level": "A1",
    "objective_id": "FR-A1-GRM-007",
    "variant_group": "A1-GRM-007-v2",
    "format": "error_correction",
    "instruction": "Correct the mistake.",
    "prompt": "Elle est ne pas contente.",
    "answer": "Elle n'est pas contente.",
    "answer_check": {
      "mode": "normalised",
      "accent_policy": "near_miss"
    },
    "hint": "Look at where 'ne' sits: it belongs right before the verb 'est'.",
    "explanation": "'Ne' must come right before the verb 'est' (is), and it shortens to 'n'' before a vowel sound. 'Elle n'est pas contente' means 'She is not happy.'",
    "difficulty": 2,
    "status": "generated",
    "provenance": {
      "method": "ai-generated",
      "model_tier": "haiku",
      "batch_id": "B001",
      "date": "2026-10-31"
    },
    "acceptable_alternatives": []
  },
  {
    "id": "Q-A1-GRM-007-003",
    "version": 1,
    "level": "A1",
    "objective_id": "FR-A1-GRM-007",
    "variant_group": "A1-GRM-007-v3",
    "format": "translate_en_fr",
    "instruction": "Translate into French.",
    "prompt": "I do not speak Spanish.",
    "answer": "Je ne parle pas espagnol.",
    "acceptable_alternatives": [
      "Je ne parle pas l'espagnol."
    ],
    "answer_check": {
      "mode": "normalised",
      "accent_policy": "near_miss"
    },
    "hint": "Put 'ne' before the verb and 'pas' after it.",
    "explanation": "To say 'not', put 'ne' before the action word (the verb) and 'pas' after it. Here 'parle' (speak) is the action word.",
    "difficulty": 2,
    "status": "generated",
    "provenance": {
      "method": "ai-generated",
      "model_tier": "haiku",
      "batch_id": "B001",
      "date": "2026-10-31"
    }
  },
  {
    "id": "Q-A1-GRM-007-004",
    "version": 1,
    "level": "A1",
    "objective_id": "FR-A1-GRM-007",
    "variant_group": "A1-GRM-007-v4",
    "format": "mcq",